{"$schema":"https://json-schema.org/draft/2020-12/schema","$id":"https://schemas.rotprods.dev/clever/v1/policy.schema.json","type":"object","additionalProperties":false,"required":["contractVersion","decisionId","evaluationId","decision","riskClass","userConfirmationRequired"],"properties":{"contractVersion":{"$ref":"https://schemas.rotprods.dev/clever/v1/common.schema.json#/$defs/contractVersion"},"decisionId":{"type":"string","minLength":1},"evaluationId":{"type":"string","minLength":1},"decision":{"type":"string","enum":["POLICY_DECISION_KIND_ALLOW","POLICY_DECISION_KIND_DENY","POLICY_DECISION_KIND_REQUIRE_CONFIRMATION"]},"riskClass":{"type":"string","enum":["RISK_CLASS_R0","RISK_CLASS_R1","RISK_CLASS_R2","RISK_CLASS_R3","RISK_CLASS_R4"]},"grantedScopes":{"type":"array","items":{"type":"string"},"uniqueItems":true},"reasonCodes":{"type":"array","items":{"type":"string"}},"userConfirmationRequired":{"type":"boolean"},"expiresAt":{"$ref":"https://schemas.rotprods.dev/clever/v1/common.schema.json#/$defs/timestamp"},"auditRef":{"type":"string"}}}
